1,"Fisher-Price CHM91 Roaring Rainforest Jumperoo, New-Born Baby Activity Centre with Music and Lights",£98.57,"This seller has only 58 of these available. To see if more are available from another seller, go to the product detail page."
2,"Disney Baby Finding Nemo Sea of Activities Jumper Packed with 13 Activities, Fun Lights, Music and Ocean Sounds",£77.92,"This seller has a limit of 4 per customer. To see if more are available from another seller, go to the product detail page."
3,Fisher-Price Rollin' Rovee,£63.10,"This seller has only 6 of these available. To see if more are available from another seller, go to the product detail page."
4,Fisher-Price Little People 1-2-3 Babies Playdate,£54.46,"This seller has only 10 of these available. To see if more are available from another seller, go to the product detail page."
5,Bright Starts Disney Baby Minnie Mouse Peekaboo Activity Jumper with Lights and Melodies,Product Unavailable
6,"Nuby Tummy Time Activity Mirror, Sensory Toy for Babies Aged 6 Months Plus",£9.99,"This seller has only 6 of these available. To see if more are available from another seller, go to the product detail page."
7,"Amycute Animal Feet Cloth Book for Babies Toddlers, Nontoxic Soft Fabric Baby Educational Sensory Learning Toy Books for 0 - 6 Months/One Years Old (G)",Product Unavailable
8,Baby Jumperoo Bouncer Swing Chair (Pink),Product Unavailable
9,Fisher-Price GGC60 3-in-1 Spin and Sort Activity Centre,£74.56,"This seller has a limit of 3 per customer. To see if more are available from another seller, go to the product detail page."
10,Children’s Activity Centre in Two Colours,Product Unavailable
11,Musical Activity Centre Baby Toy - Sound Toys 15 in 1 Activity Cube Educational Game Play Center Baby Toddler Toy with Lights and Sounds for Early Learning and Development,Product Unavailable
12,"Mattel MULTILEARNING Table Fisher Price BILINGUE 3 Game Modes, Multicoloured",Product Unavailable
13,jumini Wooden Activity Cube Bead Maze Toy – 5 in 1 Play Activity Cube with Wooden Shapes for Children 1 year+ – Made from FSC Wood – Pastel Colours,£29.99,"This seller has only 77 of these available. To see if more are available from another seller, go to the product detail page."
14,"Baby Einstein, Curiosity Table™ Activity Station Toddler Toy with Lights and Melodies, Ages 12 Months and up",Product Unavailable
15,"COSTWAY Baby Activity Centre, Infant Jumper Chair and Bouncer with 360° Rotating Seat, 3 Adjustable Height, Lights & Music, Sit-to-Stand Interactive Toy Station for 6-36 Months (Pink)",£59.95,"This seller has only 78 of these available. To see if more are available from another seller, go to the product detail page."
16,Kinderplay KP1961 Multifunctional Play Chair Activity Centre Bouncy Chair Baby Jumping Chair,Product Unavailable
17,4PC Cute Duck Snowball Maker Winter Fun Toys for Kids - Snow Ball Maker Clip Animal Shaped Snow Sand Mold Tool for Fight Winter Outdoor,£2.76,"This seller has only 293 of these available. To see if more are available from another seller, go to the product detail page."
18,"Infantino 3-in-1 Spin & Stand Entertainer - 360 seat and Activity Table with Simple Store-Away Design, Multi-Coloured",Product Unavailable
19,"Fisher-Price Petals Jumperoo, New-born Baby Activity Centre with Music and Lights, Pink",Product Unavailable
20,"Fisher-Price 2-in-1 Sit-to-Stand Activity Centre, Baby or Toddler activity Toy with Table, Seat, Textures, Colours and Sounds, for Sitting and Standing",Product Unavailable
21,"Red Kite Baby Go Round Play Centre, Under The Sea",Product Unavailable
22,"Hauck Jump Around, Stable Activity Centre from 6 Months to 12 kg, Walker with Music and Light, Height-Adjustable Play Centre, Swivelling, Hearts",Product Unavailable
23,Fisher-Price Roarin' Rainforest Jumperoo,Product Unavailable
24,Rabbit Ears Hat Rabbit Ears Headband with Moving Ear Animal Bunny Plush Toy Cap Hair Accessories Party Gift (White),£5.99,999+ quantity left
25,"HebyTinco 6 pcs Baby Cloth Books, Nontoxic Fabric Soft Baby Cloth Books, Can Be Washed Without Fading, Rich Content, Safe Nontoxic Biteable Early Learning Books, Early Educational Toys",Product Unavailable
26,Bright Starts 2-in-1 Lights N Learn Activity Gym and Saucer,Product Unavailable
27,4PC Cute Duck Snowball Maker Winter Fun Toys for Kids - Snow Ball Maker Clip Animal Shaped Snow Sand Mold Tool for Fight Winter Outdoor,£2.76,"This seller has only 293 of these available. To see if more are available from another seller, go to the product detail page."
28,iSafe 2 in 1 Activity Centre Entertainer with 360° Rotating Seat & Play Table Function (Daisy Garden),£79.95,"This seller has only 16 of these available. To see if more are available from another seller, go to the product detail page."
29,Sassy Inspire The Senses Bounce Around Activity Centre - Multi-Coloured,Product Unavailable
30,Babies Water Play Mat Fun Mat Inflatable Water Mat Ice Pillow Chair Pad Activity Play Center Accessory Promotes Visual Stimulation for Kids 1 Set L,£6.19,999+ quantity left
31,"Rapport Transport Single Duvet Cover Cars Lorries Bus Motorbikes Themed Bedding Set, Polycotton, Yellow",Product Unavailable
32,Lisciani Games 75874 Bing Educational Banquet Baby,£26.21,999+ quantity left
33,Bright Starts Sweet Safari Bounce-A-Round Baby Activity Centre (Pink),£87.40,999+ quantity left
34,Oribel Portaplay Convertible Activity Centre Forest Friends,Product Unavailable
35,iSafe 2 in 1 Activity Centre Entertainer with 360° Rotating Seat & Play Table Function (Fly High),£79.95,"This seller has only 16 of these available. To see if more are available from another seller, go to the product detail page."
36,Redkite Deluxe Jumparound Musical Baby Jumper Activity Centre Plus Bath Book Package,Product Unavailable
37,N/F Baby Slides Children’s Slides Lengthened And Thickened Slides Indoor And Home Small Slides,£16.99,"This seller has only 48 of these available. To see if more are available from another seller, go to the product detail page."
38,"Busy Board for Toddlers,Basic Skills Toddler Activity Boards,Learning Box Numbers Educational Game,Teaches Fine Motor Skills, Suitable for 1 2 3 4 Year Old Toddlers (Single Shoulder)",£19.29,"This seller has only 500 of these available. To see if more are available from another seller, go to the product detail page."
39,iSafe 2 in 1 Activity Centre Entertainer with 360° Rotating Seat & Play Table Function (Dino Land),£79.95,"This seller has only 16 of these available. To see if more are available from another seller, go to the product detail page."
40,Multifunctional Baby Jumping Chair - Baby Jumper + Baby Walker + swivel Seat - Jumperoo - Baby Bouncer - Baby Activity Center - Baby Activity - BLUE,Product Unavailable
41,"Hauck Play Around Activity Centre from 6 Months to 12 kg with Light and Sound, Height Adjustable Walker, Large, Dots",Product Unavailable
42,"Chicco Duo Gym Musical Activity Centre, 49.5 cm",Product Unavailable
43,Fisher-Price Pink Petals Jumperoo by Fisher-Price,£385.92,"This seller has only 5 of these available. To see if more are available from another seller, go to the product detail page."
44,2 in 1 Drive & Play Baby Walker Activity Centre with Lights & Sounds 12 Months+,Product Unavailable
45,Ambi Toys Focus Pocus,£13.78,999+ quantity left
46,PUDDINGT® Air Cushion Bear Baby Jumbo Activity Gym Round Activity Gym Music Play Mat Baby Playmat Play Gym Play Mat Large Activity Centre,£51.19,"This seller has only 90 of these available. To see if more are available from another seller, go to the product detail page."
47,Fillikid Activity Baby Toddler Play Centre for Ages 7m+,£89.99,"This seller has only 4 of these available. To see if more are available from another seller, go to the product detail page."
48,Chad Valley Baby Activity Saucer.,Product Unavailable
49,Baby Einstein Baby Neptune Activity Saucer Activity Play Gym,Product Unavailable
50,"Bestevery 3Pcs Jingle Bells, Christmas Bells Wooden Hand Sleigh Bells Christmas Jingle Stick Nickel Plated Jingle Bells Childrens Musical Instrument for Children Christmas Decoration",£7.06,"This seller has only 989 of these available. To see if more are available from another seller, go to the product detail page."
1,winfun 001801-NL Magic DJ Mixer,£14.68,999+ quantity left
2,Baby Einstein Around The World Activity Centre,Product Unavailable
3,"Dinglongchen Realistic Teddy Dog Lucky Christmas Gifts Handmade Plush Dog Soft Toy Stuffed Dog, Realistic Figure Plush Puppy Doll Cushion Pillow for Any Dog Christmas Decoration (Brown-A)",Product Unavailable
4,"Disney Mickey Mouse Camping 10184 Baby with Friends Activity Saucer Activity Centre, Multi-Colour",Product Unavailable
5,"Baby Crib,Zephyri MP3 Play Electric Baby Cradle Swing Crib Mosquito Net Baby Bed Travel Sleeper Baby Auto-Swing+Remote Space Safe Crib (khaki)",Product Unavailable
6,Mamas & Papas - Little Entertainer Activity Centre - Little Land,Product Unavailable
7,"Fisher-Price Activity Centre Forest-Friends, Frog, for Newborns with Music and Lights, Multicoloured, K7198",Product Unavailable
8,Skip Hop Activity Jumpscape Fold Away Jumper Jump Counter Lights & Sounds,Product Unavailable
9,Bright Starts Pretty in Pink Entertain and Grow Saucer,Product Unavailable
10,"JSJE Tummy Time Baby Warm Water Mat, Inflatable Play Mat for Infants & Toddlers, Belly Time Play Activity Center Sensory Toys Gift for 3 6 9 Months Newborn Boys Girls",£25.99,"This seller has only 49 of these available. To see if more are available from another seller, go to the product detail page."
11,Dinglongchen 2 x Magic Growing Christmas Tree Toy Boys Girls Novelty Christmas Xmas Gift Decoration (A),Product Unavailable
12,Bright Starts Entertain and Grow Baby Saucer,Product Unavailable
13,5 Pc Merry Christmas Face Mouth Protection Unisex Reusable Breathable Anti Dust Madks Safety Balaclava for Motorcycle Cycling,Product Unavailable
14,Jump and Play Activity Centre,Product Unavailable
15,Lechnical 4K HD Video Game Console Built in 568 Classic Games Mini Retro Console Wireless Controller HD Output Dual Players,£29.98,"This seller has only 100 of these available. To see if more are available from another seller, go to the product detail page."
16,Babylo Rhyme and Time 3-in-1 Activity Play Centre (Multi-Coloured),Product Unavailable
17,Sassy Inspire The Senses Bounce Around Activity Center,Product Unavailable
18,empty 2 in 1 Activity Centre Entertainer with 360deg; Rotating Seat Play Table Function (Color : Daisy Garden),Product Unavailable
19,Evenflo ExerSaucer Jump and Learn Jumper,Product Unavailable
20,Jumperoo Portable Baby Chair New-Born Baby Activity Centre Activity Jumper Rainforest,Product Unavailable
21,Bébéconfort Kamino Aristo Baby Walker (2015 Collection) - Choice of Colours,Product Unavailable
22,Bright Starts Bounce About Activity Centre,Product Unavailable
23,Early Learning Centre - 3 in 1 Lights and Sounds Walker,Product Unavailable
24,Baby Walker with Musical Activity Centre,Product Unavailable
25,Hauck Play Centre Baby Walker in Jungle Friends Design,Product Unavailable
26,Cosatto Hapi Babi Activity Centre,Product Unavailable
27,Evenflo Jump And Learn My First Pet.,Product Unavailable
28,Bébé Confort KAMINO Nature Spirit 2014 Collection Baby Walker,Product Unavailable
29,Dazzling Fisher-Price Animals of the World Jumperoo - Cleva Edition ChildSAFE Door Stopz Bundle,Product Unavailable
30,Babylo Funfair Wonderland Activity Centre,Product Unavailable
31,Baby Walker Bébé Confort Kamino Hot Chocolate,Product Unavailable
32,Bébé Confort Bouncer Baby Walker Kamino Intense red,Product Unavailable
33,Graco Baby Einstien Entertainer,Product Unavailable
34,empty 2 in 1 Activity Centre Entertainer with 360deg; Rotating Seat Play Table Function (Color : Dino Land),Product Unavailable
35,Fisher-price Rainforest Jumperoo by Fisher-Price,Product Unavailable
L,a,s,t, ,P,a,g,e, ,R,e,a,c,h,e,d
1,Bright Starts Disney Baby Minnie Mouse Peekaboo Activity Jumper with Lights and Melodies,Product Unavailable
1,"Fisher-Price CHM91 Roaring Rainforest Jumperoo, New-Born Baby Activity Centre with Music and Lights",Product Unavailable
1,"Bright Starts, Disney Baby, Finding Nemo Sea of Activities Jumper Packed with 13 Activities, Fun Lights, Music & Ocean Sounds",Product Unavailable
1,"Bright Starts, Disney Baby, Finding Nemo Sea of Activities Jumper Packed with 13 Activities, Fun Lights, Music & Ocean Sounds",Product Unavailable
